index,title,tags,authors,abstract
2503.16999,Route to Chaos in Multi-Species Ecosystems,"['nlin.AO', 'q-bio.PE', 'doi', '10.1063/5.0291485']","['Robin Delabays', 'Philippe Jacquod']","We investigate species-rich mathematical models of ecosystems. While much of the existing literature focuses on the properties of equilibrium fixed points, persistent dynamics (e.g., limit cycles or chaos) have also been observed, both in natural or lab-controlled ecosystems and in mathematical models. Here we emphasize the emergence of limit cycles following Hopf bifurcations tuned by the variability of interspecies interaction. As this variability increases, and owing to the large dimensionality of the system, limit cycles typically acquire a growing spectrum of frequencies. This often leads to the appearance of strange attractors, with a chaotic dynamics of species abundances characterized by a positive Lyapunov exponent. We observe that limit cycles and strange attractors preserve biodiversity to some extent, as they maintain dynamical stability without species extinction. We give numerical evidences that this route to chaos dominates in ecosystems with strong enough interactions and where predator-prey behavior dominates over competition and mutualism. Based on arguments from random matrix theory, we further conjecture that this scenario is generic in ecosystems with large number of species, and identify the key parameters driving it. Overall, we show that the model we consider provides a unifying framework, where a wide range of population dynamics emerge from a simple few-parameter model."
2503.16593,Ergodic behaviors in reversible 3-state cellular automata,"['cond-mat.stat-mech', 'hep-th', 'nlin.CG']","['Rustem Sharipov', 'Matija Koterle', 'Sašo Grozdanov', 'Tomaž Prosen']","Classical cellular automata represent a class of explicit discrete spacetime lattice models in which complex large-scale phenomena emerge from simple deterministic rules. With the goal to uncover different physically distinct classes of ergodic behavior, we perform a systematic study of three-state cellular automata (with a stable `vacuum' state and `particles' with $\pm$ charges). The classification is aided by the automata's different transformation properties under discrete symmetries: charge conjugation, spatial parity and time reversal. In particular, we propose a simple classification that distinguishes between types and levels of ergodic behavior in such system as quantified by the following observables: the mean return time, the number of conserved quantities, and the scaling of correlation functions. In each of the physically distinct classes, we present examples and discuss some of their phenomenology. This includes chaotic or ergodic dynamics, phase-space fragmentation, Ruelle-Pollicott resonances, existence of quasilocal charges, and anomalous transport with a variety of dynamical exponents."
2503.16526,Observation of a generalized Gibbs ensemble in photonics,"['cond-mat.quant-gas', 'cond-mat.stat-mech', 'nlin.PS', 'nlin.SI', 'physics.optics']","['Alvise Bastianello', 'Alexey Tikan', 'Francois Copie', 'Stephane Randoux', 'Pierre Suret']","In generic classical and quantum many-body systems, where typically energy and particle number are the only conserved quantities, stationary states are described by thermal equilibrium. In contrast, integrable systems showcase an infinite hierarchy of conserved quantities that inhibits conventional thermalization, forcing relaxation to a Generalized Gibbs Ensemble (GGE), a concept first introduced in quantum many-body physics. In this study, we provide experimental evidence for the emergence of a GGE in a photonic system. By investigating partially coherent waves propagating in a normal dispersion optical fiber, governed by the one-dimensional defocusing nonlinear Schroedinger equation, we directly measure the density of states of the spectral parameter (rapidity) to confirm the time invariance of the full set of conserved charges. We also observe the relaxation of optical power statistics to the GGE's theoretical prediction, obtained using the experimentally measured density of states. These complementary measurements unambiguously establish the formation of a GGE in our photonic platform, highlighting its potential as a powerful tool for probing many-body integrability and bridging classical and quantum integrable systems."
2503.16509,Earthquake Response Analysis with AI,"['cs.SI', 'cs.CL', 'cs.CY', 'nlin.AO']","['Deep Patel', 'Panthadeep Bhattacharjee', 'Amit Reza', 'Priodyuti Pradhan']","A timely and effective response is crucial to minimize damage and save lives during natural disasters like earthquakes. Microblogging platforms, particularly Twitter, have emerged as valuable real-time information sources for such events. This work explores the potential of leveraging Twitter data for earthquake response analysis. We develop a machine learning (ML) framework by incorporating natural language processing (NLP) techniques to extract and analyze relevant information from tweets posted during earthquake events. The approach primarily focuses on extracting location data from tweets to identify affected areas, generating severity maps, and utilizing WebGIS to display valuable information. The insights gained from this analysis can aid emergency responders, government agencies, humanitarian organizations, and NGOs in enhancing their disaster response strategies and facilitating more efficient resource allocation during earthquake events."
2503.16305,New exact spatially localized solutions of the (3 + 1) -dimensional nonlinear non-dissipative quasi-geostrophic potential vorticity equation for an exponential atmosphere,"['physics.flu-dyn', 'nlin.PS']","['A. G. Kudryavtsev', 'N. N. Myagkov']","New exact spatially localized stationary solutions against the background of a zonal flow are found for the (3+1)-dimensional nonlinear non-dissipative quasi-geostrophic potential vorticity equation, which describes Rossby waves and vortices in an exponential atmosphere. In total, three solutions are presented. The nonlinear boundary conditions with a flat bottom and a rigid lid generate an infinite discrete set of baroclinic modes for each solution. The solutions show the possibility of existence of baroclinic dipoles in the exponential atmosphere, similar to baroclinic dipoles in the ocean. It is shown that: a) a pair of vortices in the baroclinic dipole appears and disappears when the velocity of stationary motion changes; b) the baroclinic dipoles show the ability to transfer warm or cold air depending on the polarity of the vortices in the dipole."
2503.16240,Machine learning identifies nullclines in oscillatory dynamical systems,"['cs.LG', 'math.DS', 'nlin.AO', 'physics.comp-ph']","['Bartosz Prokop', 'Jimmy Billen', 'Nikita Frolov', 'Lendert Gelens']","We introduce CLINE (Computational Learning and Identification of Nullclines), a neural network-based method that uncovers the hidden structure of nullclines from oscillatory time series data. Unlike traditional approaches aiming at direct prediction of system dynamics, CLINE identifies static geometric features of the phase space that encode the (non)linear relationships between state variables. It overcomes challenges such as multiple time scales and strong nonlinearities while producing interpretable results convertible into symbolic differential equations. We validate CLINE on various oscillatory systems, showcasing its effectiveness."
2503.16113,Event Soliton Formation in Mixed Energy-Momentum Gaps of Nonlinear Spacetime Crystals,"['physics.optics', 'cond-mat.mtrl-sci', 'math-ph', 'nlin.PS', 'quant-ph']","['Liang Zhang', 'Zhiwei Fan', 'Yiming Pan']","We report the formation of a novel soliton, termed event soliton, in nonlinear photonic spacetime crystals (STCs). In these media, simultaneous spatiotemporal periodic modulation of the dielectric constant generates mixed frequency ($ω$) and wavevector (k) gaps. Under Kerr nonlinearity, the event solitons emerge as fully localized entities in both spacetime and energy-momentum domains, providing a tangible demonstration of the concept of event in relativity. The $ω$k-gap mixture arises from the coexistence and competition between time reflected and Bragg reflected waves due to the spatiotemporal modulation. We propose a new partial differential equation to capture various spatiotemporal patterns and present numerical simulations to validate our theoretical predictions, reflecting a three-way balance among k-gap opening, $ω$-gap opening, and nonlinearity. Our work opens avenues for fundamental studies and fosters experimental prospects for implementing spacetime crystals in both time-varying photonics and periodically driven condensed matter systems."
2503.15859,"General Classification, Invariance and Conservation Laws Analyses of Nonlinear Fourth Order Wave and Nerve Membrane Equations with Dissipation","['nlin.SI', 'math-ph']","['Ali Raza', 'F M Mahomed', 'F D Zaman', 'A H Kara']","We study the nonlinear wave equation for arbitrary function with fourth order dissipation. A special case that is analysed exclusively is the model of nerve membranes; we consider this model, both, in the presence and absence of the fourth order dissipation. The equivalence transformations, Lie symmetries and a complete classification is presented. We also discuss the one dimensional optimal system in each case obtained via classification. The reduction of the partial differential equations (PDEs) is carried out and the forms of invariant solutions are presented. The study also include the construction of conservation laws using the direct method. The invariant solutions and some special type of solutions including solitions are presented with their graphical illustrations."
2503.15806,"Kinks of fractional $φ^4$ models: existence, uniqueness, monotonicity, stability, and sharp asymptotics","['math.AP', 'nlin.PS']","['Atanas G. Stefanov', 'P. G. Kevrekidis']","In the present work we construct kink solutions for different (parabolic and wave) variants of the fractional $φ^4$ model, in both the sub-Laplacian and super-Laplacian setting. We establish existence and monotonicity results (for the sub - Laplacian case), along with sharp asymptotics which are corroborated through numerical computations. Importantly, in the sub-Laplacian regime, we provide the explicit and numerically verifiable spectral condition, which guarantees uniqueness for odd kinks. We check numerically the relevant condition to confirm the uniqueness of such solutions. In addition, we show asymptotic stability for the stationary kinks in the parabolic setting and also, the spectral stability for the traveling kinks in the corresponding wave equation."
2503.15719,Phase transitions and finite-size effects in integrable virial statistical models,"['cond-mat.stat-mech', 'hep-th', 'nlin.SI', 'nucl-th']","['Xin An', 'Francesco Giglio', 'Giulio Landolfi']","We analyze thermodynamic models for fluid systems in equilibrium based on a virial expansion of the internal energy in terms of the volume density. We prove that the models, formulated for finite-size systems with $N$ particles, are exactly solvable to any expansion order, as expectation values of physical observables (e.g., volume density) are determined from solutions to nonlinear C-integrable PDEs of hydrodynamic type. In the limit $N\to\infty$, phase transitions emerge as classical shock waves in the space of thermodynamic variables. Near critical points, we argue that the volume density exhibits a scaling behavior consistent with the Universality Conjecture in viscous transport PDEs. As an application, we employ our framework to nuclear matter and construct a global QCD phase diagram revealing critical points for the nuclear liquid-gas and hadron gas-QGP transitions. We demonstrate how finite-size effects smear critical signatures, indicating the importance of thoughtful considerations in the search for the QCD critical point."
2503.15713,Bifurcations of unstable eigenvalues for Stokes waves derived from conserved energy,"['math.AP', 'math-ph', 'nlin.PS']","['Sergey Dyachenko', 'Dmitry E. Pelinovsky']","We address Euler's equations for irrotational gravity waves in an infinitely deep fluid rewritten in conformal variables. Stokes waves are traveling waves with the smooth periodic profile. In agreement with the previous numerical results, we give a rigorous proof that the zero eigenvalue bifurcation in the linearized equations of motion for co-periodic perturbations occurs at each extremal point of the energy function versus the steepness parameter, provided that the wave speed is not extremal at the same steepness. We derive the normal form for the unstable eigenvalues and, assisted with numerical approximation of its coefficients, we show that the new unstable eigenvalues emerge only in the direction of increasing steepness."
2503.15710,Computing Classical Escape Rates from Periodic Orbits in Chaotic Hydrogen,"['nlin.CD', 'physics.atom-ph']","['Ethan T. Custodio', 'Sulimon Sattari', 'Kevin A. Mitchell']","When placed in parallel magnetic and electric fields, the electron trajectories of a classical hydrogen atom are chaotic. The classical escape rate of such a system can be computed with classical trajectory Monte Carlo techniques, but these computations require enormous numbers of trajectories, provide little understanding of the dynamical mechanisms involved, and must be completely rerun for any change of system parameter, no matter how small. We demonstrate an alternative technique to classical trajectory Monte Carlo computations, based on classical periodic orbit theory. In this technique, escape rates are computed from a relatively modest number (a few thousand) of periodic orbits of the system. One only needs the orbits' periods and stability eigenvalues. A major advantage of this approach is that one does not need to repeat the entire analysis from scratch as system parameters are varied; one can numerically continue the periodic orbits instead. We demonstrate the periodic orbit technique for the ionization of a hydrogen atom in applied parallel electric and magnetic fields. Using fundamental theories of phase space geometry, we also show how to generate nontrivial symbolic dynamics for acquiring periodic orbits in physical systems. A detailed analysis of heteroclinic tangles and how they relate to bifurcations in periodic orbits is also presented."
2503.15670,Noise equals control,"['q-bio.MN', 'cond-mat.stat-mech', 'nlin.AO', 'doi', '10.1103/vlx8-spc6']",['Eric De Giuli'],"Stochastic systems have a control-theoretic interpretation in which noise plays the role of control. In the weak-noise limit, relevant at low temperatures or in large populations, this leads to a precise mathematical mapping: the most probable trajectory between two states minimizes an action functional and corresponds to an optimal control strategy. In Langevin dynamics, the noise term itself serves as the control. For general Markov jump processes, such as chemical reaction networks or electronic circuits, we use the Doi-Peliti formalism to identify the `response' (or `momentum') field $π$ as the control variable. This resolves a long-standing interpretational problem in the field-theoretic description of stochastic systems: although $π$ evolves backward in time, it has a clear physical role as the control that steers the system along rare trajectories. This implies that Nature is constantly sampling control strategies. We illustrate the mapping on multistable chemical reaction networks, systems with unstable fixed points, and specifically on stochastic resonance and Brownian ratchets. The noise-control mapping justifies agential descriptions of these phenomena, and builds intuition for otherwise puzzling phenomena of stochastic systems: why probabilities are generically non-smooth functions of state out of thermal equilibrium; why biological mechanisms can work better in the presence of noise; and how agential behavior emerges naturally without recourse to mysticism."
2503.15537,Low Dimensional Dynamics of Globally Coupled Complex Riccati Equations: Exact Firing-rate Equations for Spiking Neurons with Clustered Substructure,"['q-bio.NC', 'nlin.SI', 'doi', '10.1103/PhysRevE.111.L052201']","['Diego Pazó', 'Rok Cestnik']","We report on an exact theory for ensembles of globally coupled, heterogeneous complex Riccati equations. A drastic dimensionality reduction to a few ordinary differential equations is achieved for Lorentzian heterogeneity. By applying this technique, we obtain low-dimensional firing-rate equations for populations of spiking neurons with a clustered substructure."
2503.15533,Spectral Transfers of Sign-Definite Invariants in Wave Turbulence,"['nlin.CD', 'physics.flu-dyn']","['Nicholas R. Salvatore', 'Giovanni Dematteis', 'Yuri V. Lvov']","We consider the spectral transfers of sign-definite invariants in general wave turbulence systems equipped with a wave kinetic equation. We develop a formalism to investigate and to characterize these transfers, based on the ability to track the exchanges within individual interactions by the detailed-conservation properties of the resonant interactions. We consider the three-wave, four-wave, five-wave and six-wave kinetic equations, introducing measures of locality of general wave turbulence system and of median step size in wave-wave scattering. We then use the proposed method to study the Majda-McLaughlin-Tabak one-dimensional model and examine the characteristics of energy and action transport. We show that energy in the direct energy cascade is dominated by local interactions, but shows a nonlocal inverse ""return flow"" that counters the direction of the cascade. The inverse action cascade is instead ruled by more nonlocal interactions, but shows a highly local direct ""return flow"". We also show that for both cascades a scale separation of over an order of magnitude is necessary to ensure a negligible interaction rate with forcing or dissipation regions, hinting at why in numerical simulations of the model an extremely large box size is necessary in order to realize the theoretical Kolmogorov-Zakharov spectra."
2503.15398,Separation of variables for higher rank integrable models: review of recent progress,"['hep-th', 'cond-mat.stat-mech', 'math-ph', 'nlin.SI', 'doi', '10.1088/1751-8121/ade103']",['Fedor Levkovich-Maslyuk'],"Separation of variables (SoV) is a powerful method expected to be applicable for a wide range of quantum integrable systems, from models in condensed matter physics to gauge and string theories. Yet its full implementation for many higher rank examples, such as SU(N) spin chains with N>2, has remained elusive for a long time. In this pedagogical review we discuss the major progress achieved recently in understanding SoV for models of this type. In particular, for rational SU(N) spin chains we describe different constructions of the SoV basis, novel compact forms for spin chain eigenstates, the functional SoV approach, and explicit computation of the SoV measure. We also discuss key first applications of these results, namely the new compact determinant representations for many observables such as scalar products and correlators."
2503.15086,Cellular Automata on Probability Measures,"['nlin.CG', 'cs.IT']","['Enrico Formenti', 'Faizal Hafiz', 'Amelia Kunze', 'Davide La Torre']","Classical Cellular Automata (CCAs) are a powerful computational framework widely used to model complex systems driven by local interactions. Their simplicity lies in the use of a finite set of states and a uniform local rule, yet this simplicity leads to rich and diverse dynamical behaviors. CCAs have found applications in numerous scientific fields, including quantum computing, biology, social sciences, and cryptography. However, traditional CCAs assume complete certainty in the state of all cells, which limits their ability to model systems with inherent uncertainty. This paper introduces a novel generalization of CCAs, termed Cellular Automata on Measures (CAMs), which extends the classical framework to incorporate probabilistic uncertainty. In this setting, the state of each cell is described by a probability measure, and the local rule operates on configurations of such measures. This generalization encompasses the traditional Bernoulli measure framework of CCAs and enables the study of more complex systems, including those with spatially varying probabilities. We provide a rigorous mathematical foundation for CAMs, demonstrate their applicability through concrete examples, and explore their potential to model the dynamics of random graphs. Additionally, we establish connections between CAMs and symbolic dynamics, presenting new avenues for research in random graph theory. This study lays the groundwork for future exploration of CAMs, offering a flexible and robust framework for modeling uncertainty in cellular automata and opening new directions for both theoretical analysis and practical applications."
2503.15076,Kink breathers on a traveling wave background in the defocusing modified Korteweg--de Vries equation,"['nlin.SI', 'math-ph', 'math.AP', 'math.CA', 'nlin.PS']","['Lynnyngs Kelly Arruda', 'Dmitry E. Pelinovsky']","We characterize a general traveling periodic wave of the defocusing mKdV (modified Korteweg--de Vries) equation by using a quotient of products of Jacobi's elliptic theta functions. Compared to the standing periodic wave of the defocusing NLS (nonlinear Schrödinger) equation, these solutions are special cases of Riemann's theta function of genus two. Based on our characterization, we derive a new two-parameter solution form which defines a general three-parameter solution form with the scaling transformation. Eigenfunctions of the Lax system for the general traveling periodic wave are also characterized as quotients of products of Jacobi's theta functions. As the main outcome of our analytical computations, we derive a new solution of the defocusing mKdV equation which describes the kink breather propagating on a general traveling wave background."
2503.15071,Instability of the peaked traveling wave in a local model for shallow water waves,"['math.AP', 'math-ph', 'math.DS', 'nlin.PS', 'nlin.SI']","['Fábio Natali', 'Dmitry E. Pelinovsky', 'Shuoyang Wang']","The traveling wave with the peaked profile arises in the limit of the family of traveling waves with the smooth profiles. We study the linear and nonlinear stability of the peaked traveling wave by using a local model for shallow water waves, which is related to the Hunter--Saxton equation. The evolution problem is well-defined in the function space $H^1_{\rm per} \cap W^{1,\infty}$, where we derive the linearized equations of motion and study the nonlinear evolution of co-periodic perturbations to the peaked periodic wave by using methods of characteristics. Within the linearized equations, we prove the spectral instability of the peaked traveling wave from the spectrum of the linearized operator in a Hilbert space, which completely covers the closed vertical strip with a specific half-width. Within the nonlinear equations, we prove the nonlinear instability of the peaked traveling wave by showing that the gradient of perturbations grow at the wave peak. By using numerical approximations of the smooth traveling waves and the spectrum of their associated linearized operator, we show that the spectral instability of the peaked traveling wave cannot be obtained in the limit along the family of the spectrally stable smooth traveling waves."
2503.15068,Beating stripe solitons arising from helicoidal spin-orbit coupling in Bose-Einstein condensates,"['cond-mat.quant-gas', 'nlin.PS']","['Cui-Cui Ding', 'Qin Zhou', 'B. A. Malomed']","We demonstrate that the model of a spatially non-uniform two-component Bose-Einstein condensate (BEC) featuring the helicoidal spin-orbit coupling (SOC), gives rise to dark-bright soliton complexes characterized by spatiotemporal periodic oscillations in each component. These solitons are formed by the superposition of dark and bright ones, and exhibit a beating state over time and a striped state across space, earning them the designation of beating stripe solitons. Our analysis demonstrates that helicoidal SOC significantly affects the formation and dynamical properties of these solitons, also serving as the primary driver for spin oscillations. Through the nonlinear superposition of the beating stripe solitons, a range of intricate scenarios of the interaction between multiple solitons emerges, including head-on collisions, bound states, and parallel states."
