index,title,tags,authors,abstract
2504.21514,Poncelet porism in singular cases,"['math.AG', 'nlin.SI']","['Vladimir Dragovic', 'Milena Radnovic']","The celebrated Poncelet porism is usually studied for a pair of smooth conics that are in a general position. Here we discuss Poncelet porism in the real plane - affine or projective, when that is not the case, i.e. the conics have at least one point of tangency or at least one of the conics is not smooth. In all such cases, we find necessary and sufficient conditions for the existence of an n-gon inscribed in one of the conics and circumscribed about the other."
2504.21513,Internal solitary and cnoidal waves of moderate amplitude in a two-layer fluid: the extended KdV equation approximation,"['physics.flu-dyn', 'nlin.PS']","['Nerijus Sidorovas', 'Dmitri Tseluiko', 'Wooyoung Choi', 'Karima Khusnutdinova']","We consider travelling internal waves in a two-layer fluid with linear shear currents from the viewpoint of the extended Korteweg-de Vries (eKdV) equation derived from a strongly-nonlinear long-wave model. Using an asymptotic Kodama-Fokas-Liu near-identity transformation, we map the eKdV equation to the Gardner equation. This improved Gardner equation has a different cubic nonlinearity coefficient and an additional transport term compared to the frequently used truncated Gardner equation. We then construct approximate solitary and cnoidal wave solutions of the eKdV equation using this mapping and test validity and performance of these approximations, as well as performance of the truncated and improved Gardner and eKdV equations, by comparison with direct numerical simulations of the strongly-nonlinear two-layer long-wave parent system in the absence of currents."
2504.21506,"Multi-lump, lump-kink and interaction of breather with other nonlinear waves of a couple Boussinesq system","['nlin.PS', 'math-ph']","['Snehalata Nasipuri', 'Prasanta Chatterjee']","We investigate the interaction characteristics of nonlinear coherent structures in the couple Boussinesq (CB) system using the Hirota bilinear approach. First, we derive the lump solutions using a positive quadratic polynomial within the Hirota perturbation technique. Next, We study the explicit interactions between lumps and one or two-kink waves, and observe double lump patterns. Furthermore, we discover the interactions of breathers, revealing a diffusion-like behavior. We notice that breather waves can interact with periodic, kink, and bright solitons for specific parameter sets in the CB system. Interactions between two chains of double breathers are also found. We analyze our results using a combination of symbolic computations and graphical representations, providing a deeper understanding of their behavior. This study reveals previously unreported nonlinear dynamics in the CB system."
2504.21359,"Ultra-Discretization of Yang-Baxter Maps, Probability Distributions and Independence Preserving Property","['nlin.SI', 'math-ph', 'math.PR', 'math.QA', 'doi', '10.3842/SIGMA.2025.084']","['Hiroki Kondo', 'Sachiko Nakajima', 'Makiko Sasada']","We study the relationship between Yang-Baxter maps and the independence preserving (IP) property, motivated by their role in integrable systems, from the perspective of ultra-discretization. Yang-Baxter maps satisfy the set-theoretic Yang-Baxter equation, while the IP property ensures independence of transformed random variables. The relationship between these two seemingly unrelated properties has recently started to be studied by Sasada and Uozumi (2024). Ultra-discretization is a concept primarily used in the context of integrable systems and is an area of active research, serving as a method for exploring the connections between different integrable systems. However, there are few studies on how the stationary distribution for integrable systems changes through ultra-discretization. In this paper, we introduce the concept of ultra-discretization for probability distributions, and prove that the properties of being a Yang-Baxter map and having the IP property are both preserved under ultra-discretization. Applying this to quadrirational Yang-Baxter maps, we confirm that their ultra-discrete versions retain these properties, yielding new examples of piecewise linear maps having the IP property. We also explore implications of our results for stationary distributions of integrable systems and pose several open questions."
2504.21352,How one can assess the chaos?,['nlin.CD'],['Marat Akhmet'],"We propose an uncertainty principle for chaos, focusing on two key characteristics: alpha unpredictability and Lorenz sensitivity. This principle outlines a limitation on the relationship between two infinite sequences that underpin these concepts. It is applicable to both deterministic and stochastic dynamics, marking a significant step toward integrating these two fields. Our initial progress in this area was achieved through research on Markov chains utilizing alpha labeling.
  Additionally, we offer suggestions on how this principle can assess the degree of chaos in specific processes. We also outline open questions regarding the relationships among various types of chaos, including a modification of the recurrence theorem."
2504.21315,Long-time asymptotics of the coupled nonlinear Schödinger equation in a weighted Sobolev space,['nlin.SI'],"['Yubin Huang', 'Liming Ling', 'Xiaoen Zhang']","We study the Cauchy problem for the focusing coupled nonlinear Schrödinger (CNLS) equation with initial data $\mathbf{q}_0$ lying in the weighted Sobolev space and the scattering data having $n$ simple zeros. Based on the corresponding $3\times3$ matrix spectral problem, we deduce the Riemann-Hilbert problem (RHP) for CNLS equation through inverse scattering transform. We remove discrete spectrum of initial RHP using Darboux transformations. By applying the nonlinear steepest-descent method for RHP introduced by Deift and Zhou, we compute the long-time asymptotic expansion of the solution $\mathbf{q}(x,t)$ to an (optimal) residual error of order $\mathcal{O}\left(t^{-3 / 4+1/(2p)}\right)$ where $2\le p<\infty$. The leading order term in this expansion is a multi-soliton whose parameters are modulated by soliton-soliton and soliton-radiation interactions. Our work strengthens and extends the earlier work regarding long-time asymptotics for solutions of the nonlinear Schrödinger equation with a delta potential and even initial data by Deift and Park."
2504.21201,General vector auxiliary differential equation finite-difference time-domain method for rotationally symmetric vector wave propagation in nonlinear optics,"['nlin.PS', 'physics.comp-ph', 'doi', '10.1364/OE.571406']","['Caleb J. Grimms', 'Robert D. Nevels']","In this paper the theory and simulation results are presented for 3D vector cylindrical rotationally symmetric electromagnetic wave propagation in an isotropic nonlinear medium using a modified finite-difference time-domain general vector auxiliary differential equation method for nonlinear polarization vectors, the nonlinear dipole moment per unit volume, including both an isotropic part and an anisotropic part. The theory is presented for both the transverse magnetic and transverse electric cases along with the combined equations. The simulation results for transverse electric spatial soliton propagation in BK7, and the simulation results for transverse electric and transverse magnetic spatial soliton propagation in fused silica, assuming a purely isotropic polarization vector, are shown. The simulation results for both transverse magnetic and transverse electric spatial soliton propagation in carbon disulfide, including the anisotropic part of the polarization vector, are also shown."
2504.21094,From NLS type matrix refactorisation problems to set-theoretical solutions of the 2- and 3-simplex equations,"['nlin.SI', 'math-ph']",['Sotiris Konstantinou-Rizos'],"We present a method for constructing hierarchies of solutions to $n$-simplex equations by variating the spectral parameter in their Lax representation. We use this method to derive new solutions to the set-theoretical 2- and 3-simplex equations which are related to the Adler map and Nonlinear Schrödinger (NLS) type equations. Moreover, we prove that some of the derived Yang--Baxter maps are completely integrable."
2504.20980,Jekyll-and-Hyde Tipping Point in an AI's Behavior,"['cs.AI', 'cs.CY', 'nlin.AO', 'physics.comp-ph', 'physics.soc-ph']","['Neil F. Johnson', 'Frank Yingjie Huo']","Trust in AI is undermined by the fact that there is no science that predicts -- or that can explain to the public -- when an LLM's output (e.g. ChatGPT) is likely to tip mid-response to become wrong, misleading, irrelevant or dangerous. With deaths and trauma already being blamed on LLMs, this uncertainty is even pushing people to treat their 'pet' LLM more politely to 'dissuade' it (or its future Artificial General Intelligence offspring) from suddenly turning on them. Here we address this acute need by deriving from first principles an exact formula for when a Jekyll-and-Hyde tipping point occurs at LLMs' most basic level. Requiring only secondary school mathematics, it shows the cause to be the AI's attention spreading so thin it suddenly snaps. This exact formula provides quantitative predictions for how the tipping-point can be delayed or prevented by changing the prompt and the AI's training. Tailored generalizations will provide policymakers and the public with a firm platform for discussing any of AI's broader uses and risks, e.g. as a personal counselor, medical advisor, decision-maker for when to use force in a conflict situation. It also meets the need for clear and transparent answers to questions like ''should I be polite to my LLM?''"
2504.20858,Chaos Meets Attention: Transformers for Large-Scale Dynamical Prediction,['nlin.CD'],"['Yi He', 'Yiming Yang', 'Xiaoyuan Cheng', 'Hai Wang', 'Xiao Xue', 'Boli Chen', 'Yukun Hu']","Generating long-term trajectories of dissipative chaotic systems autoregressively is a highly challenging task. The inherent positive Lyapunov exponents amplify prediction errors over time. Many chaotic systems possess a crucial property - ergodicity on their attractors, which makes long-term prediction possible. State-of-the-art methods address ergodicity by preserving statistical properties using optimal transport techniques. However, these methods face scalability challenges due to the curse of dimensionality when matching distributions. To overcome this bottleneck, we propose a scalable transformer-based framework capable of stably generating long-term high-dimensional and high-resolution chaotic dynamics while preserving ergodicity. Our method is grounded in a physical perspective, revisiting the Von Neumann mean ergodic theorem to ensure the preservation of long-term statistics in the $\mathcal{L}^2$ space. We introduce novel modifications to the attention mechanism, making the transformer architecture well-suited for learning large-scale chaotic systems. Compared to operator-based and transformer-based methods, our model achieves better performances across five metrics, from short-term prediction accuracy to long-term statistics. In addition to our methodological contributions, we introduce a new chaotic system benchmark: a machine learning dataset of 140$k$ snapshots of turbulent channel flow along with various evaluation metrics for both short- and long-term performances, which is well-suited for machine learning research on chaotic systems."
2504.20689,"DICOM Compatible, 3D Multimodality Image Encryption using Hyperchaotic Signal","['cs.CR', 'nlin.CD']","['Anandik N Anand', 'Sishu Shankar Muni', 'Abhishek Kaushik']","Medical image encryption plays an important role in protecting sensitive health information from cyberattacks and unauthorized access. In this paper, we introduce a secure and robust encryption scheme that is multi-modality compatible and works with MRI, CT, X-Ray and Ultrasound images for different anatomical region of interest. The method utilizes hyperchaotic signals and multi-level diffusion methods. The encryption starts by taking DICOM image as input, then padding to increase the image area. Chaotic signals are produced by a logistic map and are used to carry out pixel random permutation. Then, multi-level diffusion is carried out by 4-bit, 8-bit, radial and adjacent diffusion to provide high randomness and immunity against statistical attacks. In addition, we propose a captcha-based authentication scheme to further improve security. An algorithm generates alphanumeric captcha-based image which is encrypted with the same chaotic and diffusion methods as the medical image. Both encrypted images(DICOM image and captcha image) are then superimposed to create a final encrypted output, essentially integrating dual-layer security. Upon decryption, the superimposed image is again decomposed back to original medical and captcha images, and inverse operations are performed to obtain the original unencrypted data. Experimental results show that the proposed method provides strong protection with no loss in image integrity, thereby reducing unauthorized data breaches to a significant level. The dual-encryption approach not only protects the confidentiality of the medical images but also enhances authentication by incorporating captcha."
2504.20515,Integrability of homogeneous exact magnetic flows on spheres,"['math.DG', 'nlin.SI']","['Vladimir Dragovic', 'Borislav Gajic', 'Bozidar Jovanovic']","We consider motion of a material point placed in a constant homogeneous magnetic field in $\mathbb R^n$ and also motion restricted to the sphere $S^{n-1}$. While there is an obvious integrability of the magnetic system in $\mathbb R^n$, the integrability of the system restricted to the sphere $S^{n-1}$ is highly non-trivial. We prove complete integrability of the obtained restricted magnetic systems for $n\le 6$. The first integrals of motion of the magnetic flows on the spheres $S^{n-1}$, for $n=5$ and $n=6$, are polynomials of the degree $1$, $2$, and $3$ in momenta. We prove noncommutative integrability of the obtained magnetic flows for any $n\ge 7$ when the systems allow a reduction to the cases with $n\le 6$. We conjecture that the restricted magnetic systems on $S^{n-1}$ are integrable for all $n$."
2504.20418,An energy landscape-based theoretical framework for understanding the emergence of functions in a living system under the dynamical component interaction,"['physics.bio-ph', 'nlin.AO', 'doi', '10.1016/j.biosystems.2025.105631']","['Ryunosuke Suzuki', 'Taiji Adachi']","In a living system composed of interacting components such as molecules, cells, and tissues, each component often adaptively changes its internal states in response to interactions with its surrounding components. For example, individual tissues exhibit component-level adaptive behavior, such as growth and remodeling, in response to their mechanical interactions, resulting in the emergence of functions of a multi-tissue system. Along with the adaptive behavior of the components, their interactions exhibit dynamical changes, which strongly influence the emergence of system functions. To understand how the emergence of system functions occurs from such dynamical interactions due to component-level adaptive behavior, this study proposes a theoretical framework that formulates the dynamics of interactions among components due to the adaptive behavior of individual components. For modeling the adaptive internal state changes, we assign an energy landscape and its associated energy rate landscape for each component, leading to the generalized gradient flow model of adaptive behavior. Then, we represent interaction dynamics based on temporal changes in these energy and energy rate landscapes by formulating temporal changes in the environmental states of each component due to the adaptive behavior of individual components. Through case studies using simplified models of mechanically interacting tissues under morphological changes, our theoretical framework demonstrates that temporal changes in applied forces due to morphological changes of individual tissues determine the emergence of system functions. These findings highlight that expressing interaction dynamics based on temporal changes in energy and energy rate landscapes offers a powerful theoretical framework for understanding how system functions emerge from component-level adaptive behavior."
2504.20292,Integrable black hole dynamics in the asymptotic structure of AdS$_{3}$,"['hep-th', 'gr-qc', 'math-ph', 'nlin.PS', 'nlin.SI']","['Marcela Cárdenas', 'Francisco Correa', 'Miguel Pino']","This work deepens the study of integrable asymptotic symmetries for AdS$_{3}$. They are given by an infinite set of integrable nonlinear equations known as the Ablowitz-Kaup-Newell-Segur (AKNS) hierarchy, characterized by an also infinite set of abelian conserved charges. We present their field-dependent Killing vectors and the computation of the canonical charges associated to the asymptotic metric, together with their corresponding charge algebra. We study black hole thermodynamics and show that the temperature for stationary black holes falling in the AKNS asymptotics is always constant, even in the case where the solutions are not axisymmetric. This is related to the existence of a hyperelliptic curve, which appears as a fundamental object in many integrable systems. We also present a special solution associated with the Korteweg-de Vries equation, that is a particular case of the AKNS integrable hierarchy. It is presented in the form of a periodic soliton leading to a cnoidal KdV black hole, whose temperature is characterized by two copies of hyperelliptic curves."
2504.20270,Chaos and Regularity in an Anisotropic Soft Squircle Billiard,['nlin.CD'],"['A. González-Andrade', 'H. N. Núñez-Yépez', 'M. A. Bastarrachea-Magnani']","A hard-wall billiard is a mathematical model describing the confinement of a free particle that collides specularly and instantaneously with boundaries and discontinuities. Soft billiards are a generalization that includes a smooth boundary whose dynamics are governed by Hamiltonian equations and overcome overly simplistic representations. We study the dynamical features of an anisotropic soft-wall squircle billiard. This curve is a geometric figure that seamlessly blends the angularity of a square with the smooth curves of a circle. We characterize the billiard's emerging trajectories, exhibiting the onset of chaos and its alternation with regularity in the parameter space. We characterize the transition to chaos and the stabilization of the dynamics by revealing the nonlinearity of the parameters (squarness, ellipticity, and hardness) via the computation of Poincaré surfaces of section and the Lyapunov exponent across the parameter space. We expect our work to introduce a valuable tool to increase understanding of the onset of chaos in soft billiards."
2504.20243,Integrable systems approach to the Schottky problem and related questions,"['math.AG', 'nlin.SI']","['Samuel Grushevsky', 'Yuancheng Xie']","We give a somewhat informal introduction to the integrable systems approach to the Schottky problem, explaining how the theta functions of Jacobians can be used to provide solutions of the KP equation, and culminating with the exposition of Krichever's proof of Welters' trisecant conjecture in the most degenerate (flex line) case."
2504.20181,Phase-locking in dynamical systems and quantum mechanics,"['cond-mat.stat-mech', 'hep-th', 'math.DS', 'nlin.PS', 'quant-ph']","['Artem Alexandrov', 'Alexey Glutsyuk', 'Alexander Gorsky']","In this study, we discuss the Prufer transform that connects the dynamical system on the torus and the Hill equation, which is interpreted as either the equation of motion for the parametric oscillator or the Schrodinger equation with periodic potential. The structure of phase-locking domains in the dynamical system on torus is mapped into the band-gap structure of the Hill equation. For the parametric oscillator, we provide the relation between the non-adiabatic Hannay angle and the Poincare rotation number of the corresponding dynamical system. In terms of quantum mechanics, the integer rotation number is connected to the quantization number via the Milne quantization approach and exact WKB. Using recent results concerning the exact WKB approach in quantum mechanics, we discuss the possible non-perturbative effects in the dynamical systems on the torus and for parametric oscillator. The semiclassical WKB is interpreted in the framework of a slow-fast dynamical system. The link between the classification of the coadjoint Virasoro orbits and the Hill equation yields a classification of the phase-locking domains in the parameter space in terms of the classification of Virasoro orbits. Our picture is supported by numerical simulations for the model of the Josephson junction and Mathieu equation."
2504.20162,Anti-localization of non-stationary quasi-waves in a strongly nonlinear $β$-FPUT chain,"['nlin.PS', 'physics.class-ph']","['Serge N. Gavrilov', 'Ekaterina V. Shishkina', 'Bogdan S. Borisenkov']","Recently, a new general wave phenomenon, namely ""the anti-localization of non-stationary linear waves"", has been introduced and discussed (Shishkina et al., J. Sound. Vib. 553, 2023, 117673). This is zeroing of the propagating component for a non-stationary wave-field near a defect in infinitely long wave-guides. The phenomenon is known to be observed in both continuum and discrete mechanical systems with a defect, provided that the frequency spectrum for the corresponding homogeneous system possesses a stop-band. In this paper, we show that the anti-localization is also quite common for nonlinear systems. To demonstrate this, we numerically solve several non-stationary problems for an infinite strongly nonlinear $β$-FPUT chain with a defect. In our opinion, the anti-localization essentially influences the processes of heat transfer in linear and nonlinear lattices."
2504.20002,"Global stability of the Atlantic overturning circulation: Edge states, long transients and a boundary crisis under CO$_2$ forcing","['nlin.CD', 'math.DS', 'physics.ao-ph']","['Reyk Börner', 'Oliver Mehling', 'Jost von Hardenberg', 'Valerio Lucarini']","The Atlantic Meridional Overturning Circulation (AMOC), a crucial ocean current system, could transition to a weak state. Despite severe associated climate impacts, assessing the AMOC's response under global warming and its proximity to possible critical thresholds remains difficult. To understand future Earth system stability, a global dynamical view is needed beyond the local stability analysis underlying classical early-warning methods. Using an intermediate-complexity climate model, we explore the stability landscape of the AMOC for different atmospheric CO$_2$ concentrations. We explicitly compute the edge state (or Melancholia state), a chaotic saddle on the basin boundary separating the strong and weak AMOC attractors found in the model. While being unstable, the edge state can govern the transient climate for centuries, supporting centennial AMOC oscillations driven by atmosphere-ice-ocean interactions in the North Atlantic. At increased CO$_2$ levels projected for the near future, we reveal a boundary crisis where the current AMOC attractor disappears by colliding with the edge state. Under crisis overshoot, long chaotic transients due to ""ghost states"" lead to diverging ensemble trajectories under time-varying forcing. Rooted in dynamical systems theory, our results offer an explanation of large ensemble variance and apparent ""stochastic bifurcations"" observed in earth system models under intermediate forcing scenarios."
2504.19947,Nonlinear states of the conservative complex Swift-Hohenberg equation,"['nlin.PS', 'doi', '10.1007/s11071-025-11195-z']","['Rudy Kusdiantara', 'Hadi Susanto']","We consider the conservative complex Swift-Hohenberg equation, which belongs to the family of nonlinear fourth-order dispersive Schrödinger equations. In contrast to the well-studied one-dimensional dissipative Swift-Hohenberg equation, the complex variant introduces a wide array of largely unexplored solutions. Our study provides a fundamental step in understanding the complex characteristics of this equation, particularly for typical classes of solutions-uniform, periodic, and localized states-and their relationship with the original dissipative model. Our findings reveal significant differences between the two models. For instance, uniform solutions in the conservative model are inherently unstable, and periodic solutions are generally unstable except within a narrow parameter interval that supports multiple localized states. Furthermore, we establish a generalized Vakhitov-Kolokolov criterion to determine the stability of localized states in the conservative equation and relate it to the stability properties of the dissipative counterpart."
