index,title,tags,authors,abstract
2502.20404,Noise induced extreme events in single Fitzhugh-Nagumo oscillator,"['cond-mat.dis-nn', 'nlin.CD', 'q-bio.NC']","['S. Hariharan', 'R. Suresh', 'V. K. Chandrasekar']","The FitzHugh-Nagumo (FHN) model serves as a fundamental neuronal model which is extensively studied across various dynamical scenarios, we explore the dynamics of a scalar FHN oscillator under the influence of white noise. Unlike previous studies, in which extreme events (EE) were observed solely in coupled FHN oscillators, we demonstrate that a single system can exhibit EE induced by noise. Perturbation of the deterministic model in its steady state by random fluctuations reveals the emergence of subthreshold/small-amplitude oscillations (SAO), eventually leading to rare and extreme large-amplitude oscillations (LAO), which become particularly evident at minimal noise intensities. We elucidate the route by which these EE emerge, confirming their occurrence through probability calculations of trajectories in phase space. Additionally, our investigation reveals bursting phenomena in the system, which are characterized by specific levels of noise amplitude and elucidated using inter-spike interval statistics. At higher noise amplitudes, frequent LAO production is observed and attributed to self-induced stochastic resonance. The emergence of EE is explained through the theory of large fluctuations, with the escape rates of trajectories estimated via both analytical and numerical approaches. This study is significant because it reveals EE and bursting phenomena in a single FHN oscillator, offering potential new insights into the dynamics of neuronal populations."
2502.20401,Non-Local Elastic Lattices with $\mathcal{PT}$-Symmetry and Time Modulation: From Perfect Trapping to the Wave Boomerang Effect,"['nlin.PS', 'physics.app-ph', 'physics.class-ph']",['Emanuele Riva'],"Wave motion is fundamentally constrained by the dispersion properties of the medium, often making it challenging -- or even impossible -- to guide wave packets along desired trajectories, particularly when wave inversion is required. The paper illustrates how one-dimensional (1D) and two-dimensional (2D) non-Hermitian elastic lattices with time-varying non-local feedback interactions offer unprecedented wave guidance. By relaxing the constraint of Hermiticity while preserving $\mathcal{PT}$-symmetry of the nonlocal interactions, it is herein built a framework where the dispersion transitions from positive to negative group velocity, passing through an intermediate regime characterized by a perfectly flat band across all momenta. This effect, realized within the unbroken $\mathcal{PT}$-symmetric phase, is further enhanced by the time modulation of lattice parameters, thereby unlocking functionalities such as perfect trapping, where a wave packet is intentionally stopped, and the wave boomerang effect, where the wave packet is reversed or guided back to its initial position. The framework presented in this paper unlocks opportunities that extend beyond wave guidance, including information processing through dispersion engineering in elastic media."
2502.20291,Pontryagin-Bellman Differential Dynamic Programming for Low-Thrust Trajectory Optimization with Path Constraints,"['math.OC', 'nlin.CD']","['Yanis Sidhoum', 'Kenshiro Oguri']","We introduce a new algorithm to solve constrained nonlinear optimal control problem, with an emphasis on low-thrust trajectory in highly nonlinear dynamics. The algorithm, dubbed Pontryagin-Bellman Differential Dynamic Programming (PDDP), is the result of the incorporation of Pontryagin Minimum Principle (PMP) into the Differential Dynamic Programming (DDP) formulation. Unlike traditional indirect methods that rely on first-order shooting techniques to determine the optimal costate, PDDP optimizes the costates using a null-space trust-region method, solving a series of quadratic subproblems derived from first- and second-order sensitivities. Terminal equality constraints are handled via a general augmented Lagrangian method, while state-path constraints are enforced using a quadratic penalty approach. The resulting solution method represents a significant improvement over classical indirect methods, which are known to be ineffective for state-constrained problems. The use of DDP to optimize the costate partially reduces the inherent sensitivities of indirect methods, thereby improving the robustness to poor initial guess. Finally, the incorporation of PMP within the DDP formulation enables the design of long-duration, multi-spiral low-thrust trajectories with fewer optimization variables compared to classical DDP formulations. Although the paper emphasizes the spacecraft low-thrust trajectory optimization problem, the theoretical foundations are general and applicable to any control-affine optimal control problem."
2502.20071,PT -symmetry breaking and universal spectral statistics in quantum kicked rotors,"['quant-ph', 'cond-mat.stat-mech', 'nlin.CD', 'physics.atom-ph', 'doi', '10.1103/PhysRevA.110.062221']","['Guang Li', 'Fuxing Chen', 'Ping Fang']","We investigate the spontaneous parity-time (PT )-symmetry breaking and spectral properties of a PT symmetric quantum kicked rotor under resonance conditions. At resonance, the QKR reduces to a finite-dimensional system. In the localized regime, we find that increasing the non-Hermitian parameter always induces a transition from a phase where the states exhibit PT symmetry to one where PT symmetry is spontaneously broken. In contrast, in the delocalized regime, the existence of such a transition depends on whether the reduced system is PT symmetric. If the reduced system is not PT symmetric, PT symmetry remains in the broken phase regardless of the non-Hermitian parameter. We further analyze the spectral statistics of the system in the delocalized regime. For real energy spectra, the level-spacing distribution transitions from Wigner-Dyson statistics, associated with the Gaussian orthogonal ensemble, to Poisson statistics as the non-Hermitian parameter increases, with the intermediate regime well described by the Brody distribution. For complex spectra, the level-spacing ratios and distributions are governed by time-reversal symmetry. The spectral statistics align with predictions for non-Hermitian random matrix ensembles in classes AI† and A, depending on the presence or absence of time-reversal symmetry. Our results provide insights into the spectral characteristics of non-Hermitian quantum chaotic systems and their connection to PT symmetry."
2502.19972,Hyperelliptic sigma functions and the Kadomtsev-Petviashvili equation,"['math-ph', 'math.AG', 'nlin.SI', 'doi', '10.1016/j.physd.2025.134819']","['Takanori Ayano', 'Victor M. Buchstaber']","In this paper, a theory of hyperelliptic functions based on multidimensional sigma functions is developed and explicit formulas for hyperelliptic solutions to the Kadomtsev-Petviashvili equations KP-I and KP-II are obtained. The long-standing problem of describing the dependence of these solutions on the variation of the coefficients of the defining equation of a hyperelliptic curve, which are integrals of the equations, is solved."
2502.19696,Optimizing and reducing stochastic resonance by noise color in globally coupled bistable systems,"['physics.bio-ph', 'nlin.AO']","['Cong Liu', 'Xin-Ze Song', 'Zhi-Xi Wu', 'Guo-Yong Yuan']","We investigate the collective signal response of two typical nonlinear dynamical models, the mean-field coupled overdamped bistable oscillators and the underdamped Duffing oscillators, with respect to both the additive Ornstein-Uhlenbeck noise and the weak periodical stimulus. Based on the linear response theory, we theoretically derive the dependences of the ensemble signal response on the noise intensity and driving frequency of both systems. Furthermore, we theoretically demonstrate that the noise color monotonically weakens the strength of stochastic resonance in the overdamped situation, but nonmonotonically strengthens it in the underdamped counterpart. Such a result goes against the conventional wisdom that the color of the additive noise impairs the magnitude of stochastic resonance. Finally, we perform the numerical integration to verify our theoretical results and discuss potential connections with the functional significance of 1/f noise."
2502.19633,Empirical Discovery of Multi-Scale Transfer of Information in Dynamical Systems,"['nlin.CD', 'nlin.PS']","['Christopher W. Curtis', 'Erik M. Bollt']","In this work, we quantify the timescales and information flow associated with multiscale energy transfer in a weakly turbulent system through a greedy optimization algorithm which looks to find the maximum conditional mutual information across lagged embeddings of time series localized by wavenumber. Our results provide a detailed understanding of how wavenumbers couple in order to maintain the weakly turbulent dynamic equilibrium. The algorithm is able to detect and characterize detailed differences of information flow with corresponding distinctions in time scales for both the forward and inverse cascades, and this can be done over both fast and slower time scales. This points to our approach being of broader applicability in real-world data coming from chaotic or turbulent dynamical systems."
2502.19584,"Superdiffusion, normal diffusion and chaos in semiclassical Bose-Hubbard chains","['quant-ph', 'cond-mat.quant-gas', 'cond-mat.stat-mech', 'nlin.CD']","['Dragan Marković', 'Mihailo Čubrović']","We study the evolution of two-point correlation functions of one-dimensional Bose-Hubbard model in the semiclassical regime in the framework of Truncated Wigner Approximation (TWA) with quantum jumps as first-order corrections. At early times, the correlation functions show strong superdiffusion with universal integer exponents determined solely by the initial conditions and completely insensitive to system parameters and chaos. Only after a long time this regime crosses over to normal diffusion regime which is most robust when nonintegrability is strong. For strong nonintegrability, the system ends up in a homogeneous state while for weak nonintegrability the oscillations and inhomogeneities persist, despite the fact that chaos is nearly always strong and only weakly depends on nonintegrability parameter. We conclude that the superidiffusive regime is neither prethermalized nor a precursor to thermalization but a novel early-time phenomenon related to a special scaling symmetry of the Bose-Hubbard Hamiltonian."
2502.19330,Thresholdless nonlinearity-induced edge solitons in trimer arrays,"['nlin.PS', 'cond-mat.other', 'physics.optics', 'doi', '10.1063/10.0036750']",['Magnus Johansson'],"We consider a one-dimensional discrete nonlinear Schrödinger (DNLS) model with Kerr-type on-site nonlinearity, where the nearest-neighbor coupling constants take two different values ordered in a three-periodic sequence. The existence of localized edge states in the linear limit (Su-Schrieffer-Heeger trimer, SSH3) is known to depend on the precise location of the edge. Here, we show that for a termination that does not support linear edge states, an arbitrarily weak on-site nonlinearity will induce an edge mode with asymptotic exponential localization, bifurcating from a linear band edge. Close to the gap edge, the shape of the mode can be analytically described in a continuum approximation as one half of a standard gap soliton. The linear stability properties of nonlinear edge modes are also discussed."
2502.19292,Optimal COVID-19 vaccine prioritization by age depends critically on inter-group contacts and vaccination rates,"['q-bio.PE', 'nlin.AO', 'physics.bio-ph', 'physics.soc-ph', 'doi', '10.1098/rsos.240753']","['Iker Atienza-Diez', 'Gabriel Rodriguez-Maroto', 'Saúl Ares', 'Susanna Manrubia']","The limited availability of COVID-19 vaccines has prompted extensive research on optimal vaccination strategies. Previous studies have considered various non-pharmaceutical interventions, vaccine efficacy, and distribution strategies. In this work, we address the combined effects of inter-group contacts and vaccination rates under contact reduction, analyzing the Spanish population's demographic and age group contact patterns and incorporating reinfection dynamics. We conduct an exhaustive analysis, evaluating 362,880 permutations of 9 age groups across 6 vaccination rates and two distinct, empirically quantified scenarios for social contacts. Our results show that at intermediate-to-high vaccination rates with unrestricted social contacts, optimal age-based vaccination strategies only slightly deviate from older-to-younger prioritization, yielding marginal reductions in deaths and infections. However, when significant reductions in social contacts are enforced -similar to the lockdowns in 2020-, there are substantial improvements, particularly at moderate vaccination rates. These restrictions lead to a transition where infection propagation is halted, a scenario that became achievable during the pandemic with the observed vaccination rates. Our findings emphasize the importance of combining appropriate social contact reductions with vaccination to optimize age-based vaccination strategies, underscoring the complex, nonlinear dynamics involved in pandemic dynamics and the necessity for tailored, context-specific interventions."
2502.19283,Quasi-reversible parametric instability in presence of noise,['nlin.PS'],"['Marcel G. Clerc', 'Claudio Falcón', 'René G. Rojas']","We present an experimental and theoretical study of the effect of spatio-temporal fluctuations in quasi-reversible systems displaying a spatial quintic supercritical bifurcation. The saturation mechanism is drastically changed by the inclusion of fluctuations. Experimentally, we observe the modification of the bifurcation diagram of parametrically amplified surface waves as spatiotemporal fluctuations stemming from an underlying vortex flow are included. Theoretically, we characterize the noise-dependent effective dynamics in a model system, the parametrically driven nonlinear Schrödinger equation, subjected to noise which allows us to rationalize the effect of the underlying vortex flow on the surface waves"
2502.19063,2064 global population crisis scenario predicted by the most general dynamic model,"['q-bio.PE', 'cond-mat.dis-nn', 'nlin.CD', 'physics.soc-ph']","['Alessio Zaccone', 'Kostya Trachenko']","There is currently no consensus on how the global population will evolve in the next decades and in the next century. The reason for this uncertainty is the absence of reliable population dynamic models. In this paper, we remedy to this situation by reporting on a population dynamic model, a single nonlinear differential equation adapted from the physics of disordered systems, which is able to mathematically describe all the various regimes encountered in the global population recorded as a function of time, over the past 12000 years until now. Regimes of simple exponential growth (Malthus), logistic (Verhulst) plateaus as well as stretched-exponential and compressed-exponential growth regimes are all reliably described by this mathematical equation in its various limits. Besides showing that this is, indeed, the most general population dynamic model, we use it to explore its solutions projected into the future. In particular, two different scenarios are predicted. In one of them, which assumes that the future evolution would continue along a similar pattern as the past decades (hence without any major global ecological crisis affecting the resource exploitation), a von Foerster-type doomsday scenario with a sudden rise of the global population to unsustainable levels could appear as early as 2078. In the opposite scenario, if a global ecological crisis were to set in today, affecting the ability to exploit resources, given the current estimates of the Earth's carrying capacity, the global population is forecasted to reduce by half by 2064. Furthermore, the proposed dynamic model provides with a new aggregated parameter (K, in the model) that can be monitored and controlled so as to avoid the doomsday scenarios."
2502.19016,Robustness of the solitons against perturbations in certain nonlocal nonlinear Schrödinger type equations in Nonlinear Physics,"['nlin.PS', 'nlin.SI']","['M. D. Sreelakshmi', 'N. Sinthuja', 'N. Vishnu Priya', 'M. Senthilvelan']","The nonlocal nonlinear evolution equations describe phenomena in which wave evolution is influenced by local and nonlocal spatial and temporal variables. These equations have opened up a new wave of physically important nonlinear evolution equations. Their solutions provide insights into the interplay between nonlinearity and nonlocality, making it a cornerstone in the study of nonlocal nonlinear systems. However, the stability of such solutions has not been extensively explored in the literature. Stability analysis ensures that these solutions are robust and capable of persisting under real-world perturbations, making them physically meaningful. In this work, we examine the stability of soliton solutions of four types of nonlocal nonlinear evolutionary equations: (i) the space-shifted nonlocal nonlinear Schrödinger equation, (ii) the nonlocal complex time-reversed Hirota equation, (iii) the nonlocal real space-time-reversed modified Korteweg-de Vries equation, and (iv) a fourth-order nonlocal nonlinear Schrödinger equation. These equations arise in various physical fields such as nonlinear optics, Bose-Einstein condensates, plasmas and so on where nonlocality and nonlinearity play significant roles. We introduce certain perturbations to the soliton solutions of these equations and analyze their stability. Our findings indicate that the soliton solutions of the aforementioned equations are stable under such perturbations. To the best of our knowledge, this approach to investigating the stability of these solutions is novel."
2502.18738,PyTorchFire: A GPU-Accelerated Wildfire Simulator with Differentiable Cellular Automata,"['cs.CE', 'nlin.CG', 'physics.comp-ph', 'stat.CO', 'doi', '10.1016/j.envsoft.2025.106401']","['Zeyu Xia', 'Sibo Cheng']","Accurate and rapid prediction of wildfire trends is crucial for effective management and mitigation. However, the stochastic nature of fire propagation poses significant challenges in developing reliable simulators. In this paper, we introduce PyTorchFire, an open-access, PyTorch-based software that leverages GPU acceleration. With our redesigned differentiable wildfire Cellular Automata (CA) model, we achieve millisecond-level computational efficiency, significantly outperforming traditional CPU-based wildfire simulators on real-world-scale fires at high resolution. Real-time parameter calibration is made possible through gradient descent on our model, aligning simulations closely with observed wildfire behavior both temporally and spatially, thereby enhancing the realism of the simulations. Our PyTorchFire simulator, combined with real-world environmental data, demonstrates superior generalizability compared to supervised learning surrogate models. Its ability to predict and calibrate wildfire behavior in real-time ensures accuracy, stability, and efficiency. PyTorchFire has the potential to revolutionize wildfire simulation, serving as a powerful tool for wildfire prediction and management."
2502.18451,Constraining all possible Korteweg-de Vries type hierarchies,"['hep-th', 'math-ph', 'nlin.SI', 'doi', '10.1103/lsp2-p3b2']",['Lukas W. Lindwasser'],"The Lie algebra of symmetries generated by the left-moving current $j=\partial_-φ$ in the $2d$ single scalar conformal field theory is infinite dimensional, exhibiting mutually commuting subalgebras. The infinite dimensional mutually commuting subalgebras define integrable deformations of the $2d$ single scalar conformal field theory which preserve the Poisson bracket structure. We study these mutually commuting subalgebras, finding general properties that the generators of such a subalgebra must satisfy. Along the way, we derive constraints on integrable equations of the Korteweg-de Vries type. We also confirm that the recently found $[j]=0,-1,-2$ mutually commuting subalgebras are infinite dimensional."
2502.18432,Quadratic solitons in higher-order topological insulators,"['physics.optics', 'math-ph', 'nlin.PS', 'doi', '10.1016/j.chaos.2025.116199']",['Yaroslav V. Kartashov'],"I consider higher-order topological insulator (HOTI) created in chi(2) nonlinear medium and based on two-dimensional generalization of the Su-Schrieffer-Heeger waveguide array, where transition between trivial and topological phases is achieved by shift of the four waveguides in the unit cell towards its center or towards its periphery. Such HOTI can support linear topological corner states that give rise to rich families of quadratic topological solitons bifurcating from linear corner states. The presence of phase mismatch between parametrically interacting fundamental-frequency (FF) and second-harmonic (SH) waves drastically affects the bifurcation scenarios and domains of soliton existence, making the families of corner solitons much richer in comparison with those in HOTIs with cubic nonlinearity. For instance, the internal soliton structure strongly depends on the location of propagation constant in forbidden gaps in spectra of both FF and SH waves. Two different types of corner solitons are obtained, where either FF or SH wave dominates in the bifurcation point from linear corner state. Because the waveguides are two-mode for SH wave, its spectrum features two groups of forbidden gaps with corner states of different symmetry appearing in each of them. Such corner states give rise to different families of corner solitons. Stability analysis shows that corner solitons in quadratic HOTI may feature wide stability domains and therefore are observable experimentally. These results illustrate how parametric nonlinear interactions enrich the behavior of topological excitations and allow to control their shapes."
2502.17819,Interactions of fractional solitons with local defects: Stabilization and scattering,"['nlin.PS', 'physics.optics']","['Thawatchai Mayteevarunyoo', 'Boris A. Malomed']","Stability is an essential problem in theoretical and experimental studies of solitons in nonlinear media with fractional diffraction, which is represented by the Riesz derivative with Levy index (LI) taking values LI < 2. Fractional solitons are unstable at LI smaller or equal to 1, or LI smaller or equal to 2 in uniform one-dimensional media with the cubic or quintic self-focusing, respectively. We demonstrate that, in these cases, the solitons may be effectively stabilized by pinning to a delta-functional trapping potential (attractive defect), which is a relevant setting in optical waveguides with the effective fractional diffraction. Using the respective fractional nonlinear Schroedinger equation with the delta-functional potential term, we find that, in the case of the cubic self-focusing, the fractional solitons are fully stabilized by the pinning to the defect for LI = 1, and partly stabilized for LI < 1. In the case of the quintic self-focusing, the full and partial stabilization are found for LI = 2 and LI < 2, respectively. In both cases, the instability boundary is exactly predicted by the Vakhitov-Kolokolov criterion. Unstable solitons spontaneously transform into oscillating breathers. A variational approximation (VA) is elaborated parallel to the numerical analysis, with a conclusion that the VA produces accurate results for lower LI values, i.e., stronger fractionality. In the cubic medium, collisions of traveling stable solitons with repulsive and attractive defects are addressed too, demonstrating outcomes in the form of rebound, splitting, and passage."
2502.17754,A model for dynamical systems with strange attractors,['nlin.CD'],['Nicola Romanazzi'],"We derive a system with one degree of freedom that models a class of dynamical systems with strange attractors in three dimensions. This system retains all the characteristics of chaotic attractors and is expressed by a second-order integro-differential equation which mimics a spring-like problem. We determine the potential energy, the rate of change of the kinetic energy of this system, and show that is self-oscillating."
